{
  "schema": "t4-contract/spec",
  "version": 1,
  "delivery_id": "d-20261011-ff71bd",
  "sha256": "da4b5a1d37842f280a0bd6c0f497966e0b318aad500e19b3f9f2ad3a0d68fe5b",
  "criteria": [
    "AC1",
    "AC2",
    "AC3",
    "AC4",
    "AC5",
    "AC6",
    "AC7",
    "AC8",
    "AC9",
    "AC10",
    "AC11",
    "AC12",
    "AC13",
    "AC14",
    "AC15",
    "AC16",
    "AC17",
    "AC18",
    "AC19",
    "AC20",
    "AC21"
  ]
}
