{
  "schema": "t4-contract/spec",
  "version": 1,
  "delivery_id": "d-20261012-251ff8",
  "sha256": "56d4a50c597fd22676a73d3b3508ef9de200a07bf62d7cbd4d7c0ec74aba99ff",
  "criteria": [
    "AC1",
    "AC2",
    "AC3",
    "AC4",
    "AC5",
    "AC6",
    "AC7",
    "AC8",
    "AC9",
    "AC10",
    "AC11",
    "AC12",
    "AC13",
    "AC14",
    "AC15",
    "AC16",
    "AC17",
    "AC18",
    "AC19",
    "AC20",
    "AC21",
    "AC22",
    "AC23",
    "AC24",
    "AC25",
    "AC26",
    "AC27",
    "AC28",
    "AC29",
    "AC30",
    "AC31",
    "AC32",
    "AC33",
    "AC34",
    "AC35"
  ]
}
